{
  "id": "mubi",
  "name": "MUBI",
  "domain": "mubi.com",
  "category": "streaming",
  "regions": ["BR"],
  "billingCycles": ["monthly", "annual"],
  "aliases": ["MUBI", "MUBI.COM"],
  "websiteUrl": "https://mubi.com/pt/br",
  "managementUrl": "https://mubi.com/account",
  "cancellationUrl": null,
  "status": "active",
  "notes": null,
  "verification": {
    "level": "official",
    "verifiedAt": "2026-07-20",
    "sources": ["https://mubi.com/pt/br", "https://help.mubi.com/"]
  }
}
